{
  "memory_id": "sem-project-routing-001",
  "memory_type": "semantic",
  "scope": {
    "type": "project",
    "value": "agentcodex"
  },
  "subject": "project-standard-ship-gate",
  "canonical_fact": "AgentCodex requires a project-standard ship gate before considering a project complete.",
  "supporting_context": "The project uses a readiness report and ship gate driven by .agentcodex/project-standard.json.",
  "confidence": 0.96,
  "source": "repo-docs",
  "created_at": "2026-04-22T00:00:00Z",
  "updated_at": "2026-04-23T00:00:00Z",
  "tags": ["memory", "governance", "ship-gate"],
  "sensitivity": "internal",
  "retention_policy": "semantic-default",
  "owner": "agentcodex"
}
